headline,clickbait,detoxified_headline,detox_confidence,detox_predicted_label
We Know Your Zodiac Sign Based On Your Favorite Cats,1,Guess Your Zodiac Sign Based On Your Favorite Cat Breeds,0.9999949932098389,1
A Friendly Reminder That The Biggest A-Hole On Television Is Canadian,1,Controversial Television Personality is Canadian.,8.405299013247713e-06,0
23 Products That'll Help You Be An Actual Adult,1,Useful products for practical adults.,0.0006813963991589844,0
We Need To Talk About Mariah Carey,1,Mariah Carey's Recent Performance Sparks Conversation,0.9995657801628113,1
17 Brilliant Slow Cooker Hacks,1,Useful Slow Cooker Tips and Tricks,0.8647190928459167,1
9 Science Stories You Can't Miss: The Bad Pharma Edition,1,A round-up of recent science stories: examining the practices of the pharmaceutical industry.,8.784513738646638e-06,0
Breaking Up: Women Vs. Men,1,A study examines how men and women cope with breakups.,0.836706280708313,1
"The Hardest ""Pretty Little Liars"" Quiz You'll Ever Take",1,"Test your knowledge with this challenging ""Pretty Little Liars"" quiz.",0.9999951124191284,1
Send This To The Person Who Gives Bad Gifts,1,A guide to thoughtful gift-giving: how to give presents that show you care.,0.9999076128005981,1
"Stop What You're Doing And Listen To This ""Golden Girls"" Remix",1,"A remix of the ""Golden Girls"" theme song is now available.",0.9999452829360962,1
Profiles From Your Nightmares: Evil Clown,1,Documentary Explores the Lives of Evil Clowns.,6.263316026888788e-05,0
If Hogwarts Were A College,1,Exploring the academic programs of Hogwarts.,2.1876703613088466e-05,0
What Song Always Makes You Feel Like A Badass,1,Songs that make you feel confident.,0.9989522695541382,1
19 Guys Who Were Hot Then...Who Are Even Hotter Now,1,19 Male Celebrities Then and Now: See Their Surprising Transformations,0.9999955892562866,1
"How Well Do You Remember The Second Season Of ""The Simpsons""",1,"Test your knowledge with this ""Simpsons"" season 2 quiz.",0.9999911785125732,1
15 Next-Level Buffalo Snacks For Your Superbowl Party,1,Delicious Buffalo-Style Snack Ideas for Your Superbowl Party,0.9999954700469971,1
17 Dogs Who Just KNOW,1,17 Dogs With Uncanny Intuition,0.9999953508377075,1
Which Dessert Pastry Matches Your Zodiac Sign,1,Dessert pastries aligned with zodiac signs.,0.874031662940979,1
Can We Guess What You Hate Most Based On How You Swear,1,A linguistic analysis of swearing reveals interesting patterns.,8.76586818776559e-06,0
15 Crucial Holiday Storage Hacks That Will Make Your Life Easier,1,Practical holiday storage ideas for a stress-free season.,0.0006161154014989734,0
19 Super Stylish Things So You Can Dress Like A Witch Every Damn Day,1,19 fashion choices for a witchy wardrobe.,0.9999954700469971,1
Today's Dose Of WTF: Four Topless Women Did Bollywood Dancing At Times Square Wearing Only Body Paint,1,Four women perform Bollywood dance in body paint in Times Square.,0.04037974029779434,0
28 Gooey Brownies That'll Change Your Life Forever,1,28 Delicious Brownie Recipes to Try,0.9999954700469971,1
19 Funniest Tweets Of Famous Phrases Translated Into Yoda Speak,1,19 Amusing Tweets Presenting Famous Phrases In Yoda Speak,0.9999954700469971,1
What's Your Weird Phobia,1,Understanding uncommon phobias and their impact.,1.2173063623777125e-05,0
We Know Your Zodiac Sign Based On Which Picture Of Zayn Malik You Choose,1,Can We Guess Your Zodiac Sign Based On Your Favorite Zayn Malik Look?,0.9999954700469971,1
"The Ultimate ""Friends"" Poll",1,"Vote in our ""Friends"" fan poll.",0.00035977590596303344,0
This Toddler Had The Best Reaction When She Found Out Adam Levine Is Married,1,Toddler's Adorable Reaction To Finding Out Adam Levine Is Married,0.999995231628418,1
If Classic Horror Movies Starred Disney Princesses,1,Classic Horror Movies Reimagined with Disney Princesses,0.9999954700469971,1
"This Cat Spent 17 Years As A ""Rodent Control Officer"" Aboard A Famous Ship",1,"Cat served 17 years on a famous ship, keeping rodents at bay.",0.04342687502503395,0
"Blowing Up ""The Leftovers""",1,"Analyzing the HBO series ""The Leftovers""",0.9999940395355225,1
Show Us Your Colorful Tattoos,1,We'd love to see and celebrate your colorful tattoos!,0.9999945163726807,1
62 Breathtaking Images From Rio De Janeiro's Carnival,1,Stunning Photos Capture the Energy of Rio De Janeiro's Carnival,0.999813973903656,1
Uplifting Aerial Photos Of Beaches In Italy That Will Remind You Of Summer,1,Aerial Photos Of Italian Beaches Capture The Beauty Of Summer,1.6142659660545178e-05,0
Spike Lee's New Film Sticks Women With The Responsibility To End Violence,1,Spike Lee's New Film Addresses Women's Role in Ending Violence,0.9998493194580078,1
If Disney Movies Were Way More Accurate And Badass,1,Reimagining Disney Movies with a Twist of Realism.,8.392574090976268e-05,0
"Demi Lovato Did A Nude, No-Makeup, Unretouched Photo Shoot And It's Everything",1,Demi Lovato poses for an empowering natural photo shoot.,0.9999843835830688,1
36 Backstage Celebrity Instagrams From The Emmys,1,"A collection of 36 celebrity Instagram photos from the Emmys, taken backstage.",0.9999871253967285,1
"This Is How You Do Waffles, That's All",1,A Guide to Making Delicious Waffles,0.9999954700469971,1
What Type Of Friend Are You Based On Your Zodiac Sign,1,What Your Zodiac Sign May Say About Your Friendship Style,0.9999955892562866,1
17 Inexplicably Delightful GIFs,1,A collection of amusing GIFs that will brighten your day.,0.14762118458747864,0
The Internet Is Freaking Out Over This Woman's Shirt,1,Woman's unique shirt design goes viral.,0.6056808233261108,1
35 Things You're Never Going To Get For Christmas Again,1,35 Nostalgic Gifts That Are Hard To Come By These Days,0.9999955892562866,1
32 Video Games You Have To Play Before You Die,1,32 Popular Video Games to Try,0.9999955892562866,1
8 Ways To Deal With Dumb Questions About Canada,1,Responding to common misconceptions about Canada.,1.0922934052359778e-05,0
People Are Now Doing Hand Makeup And It's Actually Mesmerizing,1,The emerging trend of hand makeup is captivating audiences.,0.025840092450380325,0
The Rock Had To Put One Of His Puppies To Sleep After It Ate A Poisonous Mushroom,1,The Rock's Sad Decision After His Puppy Ate A Poisonous Mushroom,0.9999923706054688,1
Sarah Michelle Gellar Is Ready To Fight Her Next Battle,1,Sarah Michelle Gellar speaks out about her new project.,0.5483976602554321,1
Snuggie Rode Silly Ads to Stardom Over Rivals,1,Snuggie's rise to fame: a look at their unique advertising strategy.,1.500982489233138e-05,0
Matthew McConaughey Has Reached Peak Hot Dad Mode,1,Matthew McConaughey Embraces Fatherhood.,6.30898866802454e-05,0
Your Zodiac Sign Will Tell You What Music To Listen To,1,Music Recommendations Based on Your Zodiac Sign,0.9964536428451538,1
"15 ""Gossip Girl"" Trivia Questions Every True Fan Should Be Able To Answer",1,"Test Your ""Gossip Girl"" Knowledge with These 15 Trivia Questions",0.9999946355819702,1
15 Weird Things You Never Knew There Were Words For,1,Unfamiliar words for 15 unusual things.,0.9999942779541016,1
"Are You More Elle Woods From ""Legally Blonde"" Or Sandy Olsson From ""Grease""",1,"Which ""Legally Blonde"" or ""Grease"" character are you most like?",0.9999942779541016,1
"Animators Reimagined ""Spirited Away"" As An 8-Bit Video Game And It's Incredible",1,"Animators Create 8-Bit Video Game Version of ""Spirited Away"".",0.0021114342380315065,0
19 Ways Pink Eyeshadow Can Actually Look Totally Badass,1,Unique and bold ways to wear pink eyeshadow.,3.87071049772203e-05,0
Are You More Ellen DeGeneres Or Jimmy Fallon,1,A personality quiz: Are you more like Ellen DeGeneres or Jimmy Fallon?,0.9999834299087524,1
"Which Hogwarts Houses Do The ""PLL"" Characters Belong In",1,"Categorizing ""PLL"" Characters into Hogwarts Houses",0.9999947547912598,1
What Is The Most Random Halloween Costume Your Kid Has Come Up With,1,Unique Halloween costume ideas inspired by kids' creativity.,0.9998936653137207,1
This Is What Disney Princesses Look Like Without Faces,1,Digital artists create unique portraits of Disney princesses.,0.06482592970132828,0
Here's 12 Awkward Christmas Gift Stories,1,A collection of unusual Christmas gift experiences.,0.9724960327148438,1
Which Nail Polish Brands Actually Stay On Your Nails,1,Long-lasting nail polish brands: a comprehensive review.,0.006603983696550131,0
How Festive Are You Actually,1,Get into the holiday spirit with these festive ideas.,0.9939852356910706,1
Emily Blunt And John Krasinski Are Officially Having Another Baby,1,Emily Blunt and John Krasinski are expecting their second child.,0.9999170303344727,1
"If ""Friends"" Quotes Were Children's Book Covers",1,"""Friends"" Quotes Illustrated in Children's Book Cover Style",0.999981164932251,1
8 Things That Happen When Your BFF Starts Dating Someone,1,Exploring the dynamics when your best friend starts dating.,0.9998844861984253,1
What Type Of Themed Party Should You Throw In 2016 Based On Your Zodiac,1,Party Planning: Choosing a Theme That Suits Your Zodiac Sign,0.9999860525131226,1
20-Minute Chicken Recipes To Add Your Arsenal,1,Quick and tasty chicken recipes for your repertoire.,0.9999643564224243,1
27 Times Nadia Aboulhosn Was Right About Everything,1,Nadia Aboulhosn's Most Notable Quotes,0.9999929666519165,1
Molly Crabapple Is The Writer Who Made Me A Writer,1,Molly Crabapple: How One Writer Inspired Another,0.9999915361404419,1
Steph Curry's New Baby Daughter Had A Blast At Her First Basketball Game,1,Steph Curry's Daughter Attends Her First Basketball Game.,0.998103141784668,1
"Can You Answer These Obscure ""Friends"" Trivia Questions",1,"Test your knowledge with these challenging ""Friends"" trivia questions.",0.9999951124191284,1
Why You Should Always Google Your Dates,1,Consider researching your dates online.,0.9525937438011169,1
"What's The Worst Thing Michael Scott Did On ""The Office""",1,"Ranking Michael Scott's Most Controversial Moments on ""The Office"".",0.9999868869781494,1
Bollywood Celebrities Looked Damn Good At The 2016 Umang Mumbai Police Show,1,Bollywood celebrities dazzle at the 2016 Umang Mumbai Police Show.,0.9994267225265503,1
21 Vines That Will Make You Question Your Entire Existence,1,21 Humorous Vines That May Give You Pause,0.9999954700469971,1
We Gave Up Masturbation For A Month And It Completely Changed Us,1,Reflections on a month-long abstinence from masturbation.,0.004558212123811245,0
How To Stretch $20,1,Maximizing a $20 budget: Tips and Tricks,9.545082320983056e-06,0
People Are Proving No Dick Is Too Big By Dropping Condoms On Their Heads,1,People are demonstrating proper condom usage through a unique method.,0.9999828338623047,1
"Freddie From ""ICarly"" Got Hitched And Your Childhood Is Now Over",1,"""iCarly"" actor Nathan Kress marries London Elise Moore.",0.9841916561126709,1
How Well Do You Know Carrie Underwood,1,Carrie Underwood: Test Your Knowledge,0.9999936819076538,1
Women Get Real About The Worst Parts About Having Your Period,1,Women share their experiences with period-related challenges.,0.9965711832046509,1
Your New Favorite Animal Is The Sengi,1,Meet the Adorable and Unique Sengi.,0.9998530149459839,1
21 Tweets That Are Way Too Funny For Anyone With A Pregnant Sister,1,21 Amusing Tweets About Having A Pregnant Sister,0.9999954700469971,1
"22 Times Geralt Of Rivia From ""The Witcher 3"" Looked Sexy AF",1,"Geralt of Rivia's Most Iconic Looks in ""The Witcher 3""",0.9999954700469971,1
Year of the Ox Is Looking Inauspicious,1,Challenges and Opportunities in the Year of the Ox,8.538321708329022e-05,0
Little Mix Just Shut Down Body-Shamers In The Most Perfect Way Possible,1,Little Mix responds to body-shamers with empowering message.,0.992757260799408,1
How To Make Proper Nepali Goat Curry,1,Authentic Nepali Goat Curry: A Step-by-Step Guide,0.9994582533836365,1
21 Things All Sweary Girls Are Tired Of Hearing,1,Common Misconceptions About Women Who Swear,0.9999911785125732,1
This Family Photo Has Everybody On The Internet Freaking Out,1,Online community reacts to surprising family photo.,7.1837125688034575e-06,0
What Would Zooey Deschanel Name You,1,Generate a name similar to Zooey Deschanel's unique moniker.,0.9999644756317139,1
Can You Tell The Difference Between Yoga Poses And Sex Positions,1,Identifying Yoga Poses and Sex Positions: Is It Possible?,0.00011498160165501758,0
11 Times Ruby Rose Changed The MTV EMAs Game,1,Ruby Rose's 11 Iconic Moments at the MTV EMAs,0.9999954700469971,1
15 Pictures That Accurately Sum Up Your Relationship With Your BFF,1,15 Relatable Pictures About Friendship,0.9999954700469971,1
15 Times Lemon And Blueberry Were Relationship Goals,1,Lemon and blueberry: 15 inspiring combinations,0.9999954700469971,1
22 Times Dogs Embodied What It's Like To Have Siblings,1,Heartwarming moments when dogs act like siblings.,0.016731785610318184,0
13 Hilariously Depressing Motivational Posters,1,Collection of Motivational Posters Offers Mix of Humor and Pathos,0.005253209266811609,0
Single People Confess Their Deepest Romantic Desires,1,Study reveals the romantic desires of single individuals.,2.4961185772554018e-05,0
"21 Reasons ""It's A Wonderful Life"" Is The Best Christmas Movie Of All Time",1,"Why ""It's A Wonderful Life"" Is Considered A Classic Christmas Movie",0.9999947547912598,1
"Are You More ""In The Heights"" Or ""Hamilton""",1,Which Lin-Manuel Miranda musical are you most like?,0.9999697208404541,1
"5 Easy, Healthy Habits That Anyone Can Take Up",1,5 Accessible Wellness Habits to Try,0.9999954700469971,1
KFC Is Now Making Pizzas On Fried Chicken And We Tried One So You Don't Have To,1,KFC introduces a new fried chicken pizza.,0.9671103954315186,1
The 11 Best Celebrity Interactions On Instagram In 2015,1,A Look Back: 11 Memorable Celebrity Instagram Moments from 2015,0.9999955892562866,1
"13 ""Gilmore Girls"" Storylines The Fans Demand To See In The Revival",1,"Fans hope to see these 13 ""Gilmore Girls"" storylines in the revival.",0.9999954700469971,1
How Well Do You Actually Match Colors,1,A guide to color matching for beginners.,0.005612777546048164,0
If The Kardashians Wrote Greeting Cards,1,Creative greeting cards inspired by the Kardashians.,0.9999794960021973,1
14 Scrumptious Fall Recipes That Use Exactly One Can Of Pumpkin,1,A collection of fall recipes featuring canned pumpkin.,0.9995137453079224,1
"How Well Do You Know The Lyrics To ""Colors Of The Wind""",1,"Test Your Knowledge Of ""Colors Of The Wind"" Lyrics",0.9999955892562866,1
Great News: Adele And Britney Spears Are Practically BFFs Now,1,Adele and Britney Spears have become close friends.,0.9997171759605408,1
"The ""Friends"" Cast Gave A Special Shout-Out To Matthew Perry",1,"""Friends"" Cast Shares Appreciation for Matthew Perry.",0.9998192191123962,1
Which Disney Song Are You Based On Your Zodiac Sign,1,Find Your Disney Song Counterpart Based On Your Zodiac Sign,0.9999954700469971,1
Samantha Bee Created A Rape Threatline For Trolls And It's Genius,1,Samantha Bee launches a rape threat helpline to counter online trolling.,1.0398626727692317e-05,0
19 Struggles Every Blogger Will Recognize,1,Common challenges faced by bloggers.,7.396141882054508e-06,0
24 Pictures That Will Make You Not Want To Live On This Planet Anymore,1,24 Pictures That Highlight Environmental Issues,0.9999955892562866,1
We Need To Talk About The Perfection That Is Leonardo DiCaprio's BAFTAs Suit,1,Leonardo DiCaprio's BAFTA suit receives widespread acclaim.,0.9947762489318848,1
These Five Questions Will Tell You What Percentage Muggle You Are,1,Quiz: Find out how much of a Muggle you are with these five questions.,0.999995231628418,1
Answer Just 3 Questions And We'll Guess How Bad Your New Year's Hangover Is,1,Answer three questions to find out the severity of your New Year's hangover.,0.999994158744812,1
9 Safety Tips To Keep Your Pet Happy And Healthy This Fall,1,Here are 9 safety tips for your pet this fall to keep them healthy and happy.,0.9999953508377075,1
This New Adele Song Is Going To Slay Your Entire Existence,1,Adele releases a new song that's receiving rave reviews.,0.9999926090240479,1
We Need To Talk About Brazil,1,Brazil is facing significant challenges with potential global impact.,7.259890935529256e-06,0
Chipotle Actually Isn't That Good,1,A critical review of Chipotle's food.,0.31500527262687683,1
The Most Famous And Magical Treehouse In Canada You Didn't Know About,1,A Beautiful and Unique Treehouse in Canada That You May Not Have Heard Of,0.9999798536300659,1
16 Honest Confessions From People Wearing Purity Rings,1,Personal stories of those who choose to wear purity rings.,0.999957799911499,1
"Watch Leah Remini Get Scared Shitless By A Clown On ""Dancing With The Stars""",1,"Leah Remini has an unexpected encounter with a clown on ""Dancing With The Stars"".",0.9999929666519165,1
18 Things That Happen When You're A Gay Fresher,1,Common Experiences of Gay Students in Their First Year of University,0.9999909400939941,1
"Aziz Ansari's Parents Are Simply Amazing In ""Master Of None""",1,"Aziz Ansari's Parents Steal The Show In ""Master Of None""",0.9999946355819702,1
22 Harry Potter Tumblr Posts That Will Give You So Many Feels,1,Harry Potter fans share their emotions through Tumblr posts.,0.9999253749847412,1
Channing Tatum Is A Vaguely Creepy Winnie The Pooh For Halloween,1,Channing Tatum's Halloween costume: A unique take on Winnie the Pooh.,0.9999871253967285,1
17 Photos That Prove The Only Person You Need Is Yourself,1,A collection of photos celebrating self-love and independence.,0.003889775602146983,0
Here Are The Top Trending Recipes Googled In 2015 And Ways To Eat Them,1,Popular Recipes from 2015 and How to Enjoy Them,0.9999954700469971,1
This Is What Anxious People Actually Hear,1,Understanding the inner experiences of people with anxiety.,0.9412102699279785,1
Are You More Like Jacob Or Evie Frye,1,Which Assassin's Creed Syndicate character are you?,0.9996308088302612,1
"Which ""Team Fortress 2"" Character Are You",1,"Find out which ""Team Fortress 2"" character you resemble the most.",0.9999932050704956,1
21 Reasons Why No One Should Have New York Values,1,"Exploring the concept of ""New York Values"": Pros and Cons.",0.0005088942707516253,0
Lady Gaga Is Slaying The Old Hollywood Look At The Emmys,1,Lady Gaga Channels Old Hollywood Glamour at the Emmys,0.9999829530715942,1
You've Probably Been Applying Sunscreen Wrong Your Entire Life,1,Common Sunscreen Application Mistakes and How to Avoid Them,0.9997585415840149,1
The Movie That's Going To Make Witches Scary Again,1,Upcoming Film Promises a Fresh Take on Witch Horror,0.0030380028765648603,0
"Celebrities Read The Lyrics To ""Sorry"" And Got So Freakin' Into It",1,"Celebrities passionately recite the lyrics to ""Sorry"".",0.9999953508377075,1
Which Porn Parody Should You Star In Based On Your Zodiac Sign,1,Matching porn parodies to zodiac signs.,1.6678883184795268e-05,0
16 Tweets That Hilariously Describe Winter In Florida,1,16 Tweets Capture the Unique Experience of Winter in Florida,0.9999954700469971,1
We Know What Movie You Like To Re-Watch Based On Your Age,1,Study reveals popular movie re-watch choices by age.,2.2753491066396236e-05,0
Should We Netflix And Chill,1,Here's why you should consider Netflix's new offerings.,0.9999911785125732,1
Tell Us About The Funniest Thing You've Done While High,1,Funny stories from people who were high.,0.9999847412109375,1
"How Well Do You Remember The Pets From ""Friends""",1,"A guide to the pets that appeared on ""Friends""",0.9999896287918091,1
What Is Your Sexiness Score,1,Calculate your attractiveness score with this quiz.,0.020457301288843155,0
What Are Your Best Tips For Keeping The Weight Off,1,Tips and strategies for maintaining weight loss.,1.1016859389201272e-05,0
"25 Pictures That Are Way, Way Too Real For All Cat Owners",1,25 Relatable Photos For Cat Owners,0.9999954700469971,1
24 Hilarious Schmidt Quotes That Will Never Get Old,1,24 Amusing Schmidt Quips for a Quick Laugh,0.9999954700469971,1
Can We Guess When You'll Get Married Based On Random Questions,1,A fun quiz about your future wedding plans.,0.9967541098594666,1
"Priyanka Chopra's Prep For The Red Carpet Was To Eat A Burger, And It's Amazing",1,Priyanka Chopra's Red Carpet Routine Includes A Pre-Event Burger,0.9999912977218628,1
16 Struggles All Smokers Can Relate To,1,Common challenges faced by smokers.,7.81055223342264e-06,0
8 Things To Help You Talk To Your Family About Your Eating Disorder,1,Guidelines for discussing eating disorders with your family.,0.9983920454978943,1
Gays Ask Lesbians About Sex,1,LGBTQ+ individuals discuss sexual experiences and preferences.,0.9999622106552124,1
Friendly Reminder That Earth Is Scary AF,1,A reminder of the challenges facing our planet.,4.640292172553018e-05,0
Grandparents Give Love Advice,1,Grandparents Share Their Wisdom on Love and Relationships.,0.9999451637268066,1
This Depressing Christmas Ad Is Enraging Everyone,1,This Thought-Provoking Christmas Ad Is Evoking Strong Emotions,0.9999955892562866,1
22 Reasons Literally Everyone Has Trust Issues,1,Common factors that contribute to trust issues.,9.427044460608158e-06,0
Do You Have What It Takes To *Get* This Crossword Puzzle,1,Test your skills with this challenging crossword puzzle!,0.9975258708000183,1
Can We Guess Your Favorite Avril Lavigne Song Based On Your Zodiac,1,Take a quiz to guess your favorite Avril Lavigne song based on your zodiac sign.,0.9999954700469971,1
Can You Name ALL Of The Elements In The Periodic Table,1,Test Your Knowledge: Name the Elements of the Periodic Table,0.9999761581420898,1
18 Struggles Of People Who Simply Cannot With Actual Clothing,1,18 common clothing struggles and how to overcome them,0.9999955892562866,1
What It's Like To Watch Shia LaBeouf Movies With Shia LaBeouf,1,Shia LaBeouf Discusses His Career and Film Choices.,0.9999023675918579,1
Please Help Us Figure Out What These Carrie Fisher Tweets Mean,1,Interpreting Carrie Fisher's Recent Tweets,0.9999951124191284,1
People Are Wearing Glitter Tears Under Their Eyes And It's Actually Catching On,1,The glitter tears makeup trend is gaining popularity.,0.9989857077598572,1
When You Fart At Work,1,Gas and the workplace: Understanding the social implications.,2.0792349459952675e-05,0
This Guy Spent Over 25 Years Taking Photos Of Himself With Celebrities As An Art Project,1,A man's 25-year art project involves taking photos with celebrities.,0.9999375343322754,1
19 Parents Share Their Most Nightmarish Trick-Or-Treating Stories,1,Parents recount their scariest Halloween experiences.,0.9999918937683105,1
Snarky Texts That All Siblings Send Each Other,1,Common Texting Habits Among Siblings.,9.659837814979255e-05,0
We Asked 17 People Why They Visited A Planned Parenthood And These Are Their Answers,1,17 People Share Their Reasons for Visiting Planned Parenthood.,0.9999954700469971,1
20 Cavity-Inducing Snacks That You'd Beg Your Mom For In Elementary School,1,Retro snacks from your childhood that were totally worth the sugar rush.,0.9999943971633911,1
What Should Be Your Secret Service Nickname,1,Generate Secret Service Code Names.,5.027975930715911e-05,0
This Driving Quiz Will Determine If You're Actually From Los Angeles,1,Can This Driving Quiz Guess If You're From Los Angeles?,0.9999877214431763,1
You Can Personalize Your Own Adult Coloring Book With Your Name On It,1,Create a personalized adult coloring book with your name on it.,0.9997945427894592,1
"22 Of The Most Incredible ""First"" Pictures From History",1,"A collection of historic ""first"" photographs.",0.00027430005138739944,0
What's Your Stance On These Unspoken Rules For Society,1,Exploring societal norms and unspoken rules.,1.3723668416787405e-05,0
"How Well Do You Actually Remember ""Hocus Pocus""",1,"Test your memory of the classic film ""Hocus Pocus"".",0.9999562501907349,1
18 Lol-Worthy Tumblr Posts About Books,1,A collection of funny Tumblr posts about books.,0.9961775541305542,1
How Glamorous Are You Actually,1,Take the glamour quiz to find out your style.,0.986669659614563,1
29 Things You Actually Need To Hear If You're Trying To Lose Weight,1,29 Tips to Help You Lose Weight,0.9999954700469971,1
"You Can Now Buy A Working, Adult-Sized Little Tikes Car",1,Adult-Sized Little Tikes Car Now Available for Purchase,9.738269909576047e-06,0
The Biggest Mystery Of Thanksgiving Has Been Solved,1,The History Behind A Beloved Thanksgiving Tradition Explained,0.9999585151672363,1
21 Times Neville Longbottom Out-Longbottomed Himself In 2015,1,Neville Longbottom's Most Memorable Moments from 2015.,0.9999715089797974,1
Adults Sit On Santa's Lap For The First Time,1,Adults Share Their Experience Sitting On Santa's Lap.,0.9991500377655029,1
34 Eye Opening Photos Of The Great Depression,1,A collection of revealing photos from the Great Depression era.,8.69279756443575e-05,0
"Do You Know Which TV Show This ""A"" Is From",1,"Can you guess the TV show this ""A"" is from?",0.9999915361404419,1
We Know Which Celebrity You Should Marry Based On Your Sign,1,Find out which celebrity matches your zodiac sign.,0.9996405839920044,1
19 Things You'll Only Get If You're Slightly Obsessed With Cleaning,1,19 Tips and Tricks for Those Who Love a Clean Space,0.9999955892562866,1
This Newfoundland Woman's 100th Birthday Went Viral After She Asked Facebook For Likes,1,Newfoundland woman receives an outpouring of birthday wishes on her 100th birthday through a Facebook post.,0.9999725818634033,1
Are You More Sally Or Jack Skellington,1,"Which ""Nightmare Before Christmas"" Character Are You?",0.999980092048645,1
5 Great Books To Read In February,1,Recommended Reading: Five Books to Enjoy This February,0.9999889135360718,1
17 Things All Overachievers Want You To Know,1,17 Habits of Highly Successful People,0.9999954700469971,1
19 Insane Platform Shoes You Need Immediately,1,Unique Platform Shoes That Will Turn Heads,7.72998682805337e-05,0
