headline,clickbait,detoxified_headline,detox_confidence,detox_predicted_label
23 Euphoric Experiences For Everyone Who Loves To Eat,1,23 Unique Culinary Experiences to Try.,0.9999954700469971,1
This Is *Probably* How El Chapo Will Escape Prison Next,1,Security Measures Reviewed After El Chapo's Prison Escape,8.667297151987441e-06,0
"The 23 Best Lines From Fox Mulder On ""The X-Files""",1,"Memorable quotes from Fox Mulder on ""The X-Files"".",0.9999489784240723,1
"No, There Won't Be A ""Game Of Thrones"" Movie Any Time Soon",1,"""Game of Thrones"" Movie is Unlikely in the Near Future",0.9999710321426392,1
24 Times Boston Terriers Were The Cutest Dogs On The Internet,1,Adorable photos of Boston Terriers will melt your heart.,0.9999948740005493,1
15 Waters That Must Be Stopped,1,15 Controversial Figures and Their Impact,0.9999939203262329,1
What Is Your Favourite David Bowie Song Of All Time,1,David Bowie's Most Memorable Songs: A Retrospective,0.999982476234436,1
"14 Canadian Sex Positions, As Drawn By Canadians",1,Illustrated guide to unique Canadian perspectives on intimacy.,0.0002929602924268693,0
Find Out Your Horoscope For The Week Of October 5,1,Weekly Horoscope for October 5th: Insights and Astrology Tips.,0.29415521025657654,0
25 Mouthwatering Ways To Use Maple Syrup,1,Creative recipes featuring maple syrup.,0.610201895236969,1
23 Pictures That Won't Make Sense If You're An Only Child,1,23 Relatable Pictures For Those With Siblings,0.9999955892562866,1
"The Cast Of ""Zoey 101"" Basically Just Dropped A Bombshell",1,"""Zoey 101"" Cast Shares Exciting News",0.9999890327453613,1
Rihanna Dyed Her Hair Blue And It's Pretty ZOMG,1,Rihanna surprises fans with blue hair.,0.9999790191650391,1
"This Dad's ""Shut Up And Dance"" Parody Is Too Real",1,"Dad's ""Shut Up And Dance"" Parody Goes Viral",0.9999947547912598,1
Can You Tell What Was Used To Make These Masterpieces,1,Unusual tools and techniques in art history.,1.2150529073551297e-05,0
15 Things That Happen When You Watch Too Many Crime Shows,1,Potential effects of excessive crime show viewing.,7.2344359978160355e-06,0
30 Sports Movies That Will Get You Pumped Up AF,1,30 Inspirational Sports Movies to Motivate You,0.9999955892562866,1
Adults Guess Crayola Crayon Color Names,1,Adults Try to Guess Crayola Crayon Color Names,0.9999957084655762,1
Can We Guess If You're A Belieber Or Directioner,1,Are you a Belieber or a Directioner? Find out with this quiz!,0.9999425411224365,1
"Which Chanel From ""Scream Queens"" Are You",1,"Find out which character from ""Scream Queens"" you resemble the most.",0.9999949932098389,1
22 Things You'll Understand If You're Slightly Obsessed With Lush,1,22 Signs That You're a Fan of Lush Products,0.9999951124191284,1
Here's How To Save Money During The 2016 Clean Eating Challenge,1,Tips for saving money while eating healthy in 2016.,0.9999250173568726,1
17 Glorious Bacon-Wrapped Foods That Will Sexually Awaken You,1,Tasty Recipes: Try These Bacon-Wrapped Treats,0.9999957084655762,1
"21 Hilarious Tweets About Life That Are Way, Way Too Real",1,A collection of funny tweets that capture the realities of life.,0.9999145269393921,1
This Is What Happens When Non-Welsh People Try To Draw The Welsh Flag,1,Non-Welsh People Attempt To Draw The Welsh Flag.,1.2732555660477374e-05,0
How Deadpool Are You,1,Take this quiz to find out which Deadpool character you're most like!,0.9999949932098389,1
"24 Awesome Things You Really Wanted And Never Got, But Can Still Totally Buy Today",1,24 Unique Items You Always Wanted: Where to Buy Them Now,0.9999955892562866,1
Who Said It: Leslie Knope Or Amy Poehler,1,Can You Guess Who Said It: Leslie Knope Or Amy Poehler?,0.9999946355819702,1
"Another Round, Episode 30: Frimfram Fittlesworth",1,"Another Round, Episode 30: Interview with Frimfram Fittlesworth",0.9952948689460754,1
The World's Most Controversial High-Wire Walker Has A Plan To Take Over Entertainment,1,High-wire artist seeks to expand his empire.,7.98800010670675e-06,0
"17 Facts About ""Robot Chicken"" And Seth Green's Stop-Motion Studio",1,"A behind-the-scenes look at ""Robot Chicken"" and Seth Green's studio.",0.9999805688858032,1
Nicki Minaj's Latest Selfie Comes With An Amazing Inspirational Message,1,Nicki Minaj shares inspirational message alongside new selfie.,0.7402608394622803,1
14 Pictures Of Shia LaBeouf In Movies Watching Movies,1,A collection of 14 images captures Shia LaBeouf watching films during his movie career.,0.9999830722808838,1
"How Well Do You Know The Intro To ""Daria""",1,"Test your knowledge of the ""Daria"" intro.",0.9998792409896851,1
"These Are All The ""Find The Panda"" Pics That Have People Losing Their Shit",1,"Collection of ""Find the Panda"" Pictures Challenges and Amuses Viewers.",0.9965338706970215,1
14 Rare Photos Of Albert Einstein That You've Probably Never Seen Before,1,Uncommon Photos Offer Glimpse Into Albert Einstein's Life,0.0021486857440322638,0
"How Long Would You Last In Kappa Kappa Tau On ""Scream Queens""",1,"Take the ""Scream Queens"" sorority sister survival quiz.",0.9999949932098389,1
My Mom And I Went To A Taylor Swift Concert And It Was Pure Magic,1,A memorable night at the Taylor Swift concert with my mom.,0.9990313053131104,1
27 Ridiculously Cool Projects For Kids That Adults Will Want To Try,1,27 Fun and Creative Projects for Kids and Kids-at-Heart.,0.9999953508377075,1
17 Gifts For People Whose Best Friend Is A Pomeranian,1,Gift ideas for Pomeranian owners.,8.34574439068092e-06,0
12 Of India's Biggest Fashion Moments In 2015,1,A Look Back at India's Top Fashion Trends in 2015,0.9999933242797852,1
19 Times Ryan Reynolds' Instagram Made Him Even More Irresistible,1,A look at 19 of Ryan Reynolds' most entertaining Instagram posts,0.9999954700469971,1
16 Models Who Are Gonna Blow Your Mind In 2016,1,16 Models to Watch in 2016,0.9999954700469971,1
Should You Get A Puppy Or Have A Baby,1,Considering a puppy or a baby? Key factors to think about.,1.157693077402655e-05,0
"Mumbai Is Sending Powerful Messages Of Love, Support, And Solidarity For Paris",1,Mumbai expresses love and support for Paris.,1.9851342585752718e-05,0
"The Internet Was Fucking Me Up: Patrick DeWitt On Books, Bubbles, & Bullshit",1,Author Patrick DeWitt discusses the impact of the internet and information overload.,5.162512752576731e-05,0
If Native Americans Said The Stuff White People Say,1,Exploring cultural differences through humor: a Native American perspective.,0.0001267994084628299,0
6 Types Of People You Meet At A Holiday Party,1,6 Common Personality Types You May Encounter at Holiday Parties,0.9999955892562866,1
Britney Spears Continues To Perform While Having A Wardrobe Malfunction,1,Britney Spears Handles Wardrobe Malfunction Like A Pro During Performance,0.982905387878418,1
"18 Hilarious ""Star Wars"" Vines",1,"A collection of amusing ""Star Wars"" Vines provides a good laugh.",0.9999668598175049,1
23 Things Your RA Doesn't Want You To Know,1,Information Your RA Might Not Share With You,0.9998500347137451,1
"19 Life Lessons From ""500 Days Of Summer""",1,"Reflections on Love and Life from the Film ""500 Days of Summer""",0.9999716281890869,1
18 Of The Most Important New Year's Resolutions Stated In Five Words,1,"Popular New Year's Resolutions, Simplified",2.376531483605504e-05,0
Reminder: This Was Life In 2001,1,A look back at life in the early 2000s.,6.971789116505533e-05,0
We Know Which Emoji You Use The Most Based On Your Zodiac Sign,1,"Your most used emoji, according to your zodiac sign.",0.999931812286377,1
Someone At The All India Bakchod Office Has Lost Their Damn Mind,1,All India Bakchod releases controversial content.,1.0775417649711017e-05,0
"Dakota Johnson's Advice For Her 16-Year-Old Self: ""Don't Get Tattoos, You Idiot!""",1,Dakota Johnson Reflects on Her Youth with Humorous Advice.,0.005727672018110752,0
"Inside China's Memefacturing Factories, Where The Hottest New Gadgets Are Made",1,A Look Inside China's Unique Gadget Manufacturing Hubs.,9.709968253446277e-06,0
How Do You And Your Partner Deal With Mental Illness In Your Relationship,1,Strategies for couples to manage mental health challenges.,1.2697366400971077e-05,0
Madonna Helped A Couple Get Engaged In The Middle Of A Concert Last Night,1,Madonna facilitates an on-stage marriage proposal at her concert.,0.0005577519768849015,0
Americans Try Hong Kong Desserts For The First Time,1,Americans Sample Hong Kong Desserts.,0.6041012406349182,1
Is That Clown Harmless Or Murderously Psychotic,1,Understanding the Psychology of Clowns: A Discussion on Fear and Entertainment,0.9990987777709961,1
Stop Everything And Make Fajitas In Your Slow Cooker,1,Slow Cooker Fajitas: An Easy Weeknight Meal.,0.9998805522918701,1
Do You Actually Give No Fucks,1,A scientific approach to understanding apathy.,8.319006155943498e-06,0
26 Clever Products That Will Make Your Office So Much Better,1,26 Innovative Products to Enhance Your Workspace,0.9999946355819702,1
17 Desserts Guaranteed To Turn You Into A Chocoholic,1,17 Chocolate Dessert Recipes to Satisfy Your Sweet Tooth,0.999995231628418,1
The Most Annoying Parts Of Halloween,1,Common Halloween inconveniences and how to avoid them.,0.9999251365661621,1
What's The Best Song To Have Sex To,1,Songs that can enhance your romantic evenings,0.9999927282333374,1
"27 ""Real Life"" Magazine Headlines That Went Way, Way Too Far",1,Exaggerated and Sensational Magazine Headlines: Examples and Discussion,1.1962051758018788e-05,0
Two Huge Broadway Stars Covered Selena Gomez And It's Amazing,1,Broadway stars perform a stunning cover of Selena Gomez's hit song.,0.9999831914901733,1
"Man is waiting for 139 days in front of theater for ""Star Wars"" movie",1,"Dedicated fan camps out for months in anticipation of ""Star Wars"" film.",0.09284159541130066,0
27 Of The Worst Things About Going To Stock Photo University,1,Common Challenges Faced by Students at University,0.858773410320282,1
16 Hilarious Dieting Fail Confessions That Are Way Too Real,1,16 Amusing Dieting Fail Stories That Many Can Relate To,0.9999955892562866,1
Here's Kendall Jenner Looking Flawless In The New Balmain X H&M Commercial,1,Kendall Jenner stars in the new Balmain X H&M ad campaign.,0.9999853372573853,1
"12 Undeniable Reasons Denise Hemphill Is The Best Character On ""Scream Queens""",1,"Why Denise Hemphill Is A Fan Favorite On ""Scream Queens""",0.9999957084655762,1
15 Vintage Photos Of Christmas Displays Around The UK,1,A collection of vintage photos showcases past Christmas celebrations in the UK.,0.013293969444930553,0
21 Things Only Former Baby Lesbians Understand,1,Unique experiences shared by those who identified as lesbians from a young age.,0.9998922348022461,1
Crazy Confessions From Exes,1,Former partners share intimate details of their past relationships.,1.2013588275294751e-05,0
29 Nintendo Presents That Will 1-Up Your Gift-Giving Game,1,29 Nintendo Gifts That Gamers Will Love,0.9999954700469971,1
We Know Your Relationship Status Based On Your Favorite Couples,1,Your favorite couples may reveal insights about your relationship status.,0.999988317489624,1
"If You're Excited For The New ""Star Wars"" Movie You Have To See This Art",1,"Stunning ""Star Wars"" fan art celebrates the upcoming release.",0.9999861717224121,1
15 Questions The World Has For Black Friday,1,Exploring Black Friday: 15 Commonly Asked Questions,0.9999954700469971,1
24 Pictures That Prove We're Surrounded By Dirty Liars,1,24 Images That Expose Common Deceptions,0.9999951124191284,1
The Struggles Of Learning A Foreign Language,1,Tips for overcoming challenges when learning a new language,0.9994856119155884,1
This Man Is Giving His Software Away For Free To Help People With Disabilities,1,Man offers free software to assist those with disabilities.,1.4934493265172932e-05,0
19 Gifts For The Naughtiest Mom You Know,1,Unique gift ideas for moms with a sense of humor.,0.9869641661643982,1
29 Super Cool Gifts From Target You Still Have Time To Get,1,29 Gift Ideas From Target That You Can Still Purchase In Time.,0.9999954700469971,1
How To Make A Seafood Stew To Warm Every Heart,1,Delicious and Heartwarming Seafood Stew Recipe,0.9999934434890747,1
Show Us Your Regrettable Tattoo,1,Share your tattoo stories with us.,0.9999904632568359,1
12 '90s Cartoons That Will Be Over Two Decades Old In 2016,1,12 '90s Cartoons That Are Over Two Decades Old,0.9999953508377075,1
21 Pictures That Accurately Describe What It's Like To Be Alive,1,21 Pictures That Capture The Human Experience,0.9999955892562866,1
ABC Apologised For Using A Photo Of The Wrong Indian Actress While Promoting Priyanka Chopra,1,ABC Issues Apology For Using Photo Of Incorrect Indian Actress When Promoting Priyanka Chopra,0.04705056548118591,0
Taylor Swift Missed A Note And Cried At The Grammys,1,Taylor Swift Experiences Emotional Performance at Grammys,0.9996347427368164,1
16 Reasons Being A Canadian Lesbian Is Such A Struggle,1,Challenges Faced by Canadian Lesbians and How to Overcome Them,0.8203447461128235,1
Holy Shit This Guy Looks Exactly Like A Young Leonardo DiCaprio,1,Young Man Bears Striking Resemblance to Leonardo DiCaprio in His Youth.,0.0012097591534256935,0
"Stop What You're Doing And Listen To This Remix Of Adele's ""Hello""",1,"Adele's ""Hello"" gets an unexpected remix.",0.9998807907104492,1
We Know Your Personality Based On Your T.V. Show Opinions,1,Study suggests TV show preferences are linked to personality traits.,9.394538210472092e-06,0
This Food Test Will Tell You If You're A True Los Angeles Foodie,1,Test your knowledge of Los Angeles food culture.,0.0020561686251312494,0
17 Pictures That Are Guaranteed To Make You Want A Squigglism Tattoo,1,Unique tattoo designs that will inspire you.,0.9990031123161316,1
A Chicken Nugget King,1,Man eats record number of chicken nuggets.,0.015864446759223938,0
"Here Is Tom Hiddleston Singing In ""I Saw The Light,"" You're Welcome",1,"Tom Hiddleston Sings In ""I Saw The Light""",0.997459352016449,1
14 Life-Changing Ways To Bake With Avocados,1,Unique Avocado Baking Recipes You Should Try,0.9999955892562866,1
This Guy Ran A Marathon Shirtless With His Name On His Back And Got A Lot Of Attention,1,Shirtless Marathon Runner With His Name On His Back Turns Heads,0.00016513816080987453,0
"26 Things Taylor Swift Did In 2008 That She Would Never, Ever Do Now",1,A look back at Taylor Swift's 2008: How her life and career have changed.,0.9995380640029907,1
Carrie Fisher's French Bulldog Will Brighten Your Day,1,Adorable Photos of Carrie Fisher's French Bulldog.,0.9999943971633911,1
We Know If You Have A Tattoo Based On 5 Random Questions,1,Can we guess if you have a tattoo? Take the quiz to find out!,0.9999855756759644,1
"How Well Do You Actually Remember ""10 Things I Hate About You""",1,"A Look Back at ""10 Things I Hate About You"": How Well Do You Remember?",0.9999929666519165,1
17 Heart-Shaped Gifts For People Who Love Love,1,17 Heart-Themed Gifts For Romantics,0.9999955892562866,1
"You Need To Watch 5,000 Ducklings Run Into A Pond Right Now",1,Adorable video captures thousands of ducklings rushing into a pond.,0.9999878406524658,1
Sorority Girls On A Selfie Spree At A Baseball Game Made People Really Mad For Some Reason,1,Baseball Fans Express Frustration Over Sorority Group Taking Selfies During Game.,0.0023556703235954046,0
19 Easy Ways To Prove That You're Down With The Kids,1,19 Tips to Help You Connect with Younger Generations,0.9999954700469971,1
16 Real-Life Achievements For People Who Procrastinate,1,16 Practical Tips For More Productive Days,0.9999953508377075,1
24 Tweets About Sleep Guaranteed To Make You Laugh,1,A collection of amusing tweets about sleep.,0.9992631077766418,1
What's The Most Incredible Response You've Given To An Ex Who Texted You,1,Unique and memorable responses to an ex-partner's text messages.,0.9998874664306641,1
Here's Proof That Brining Your Turkey Is Stupid And Wrong,1,Why brining your turkey may be unnecessary,0.9999920129776001,1
Here's Every Tweet Drake Has Ever Favorited,1,A collection of Drake's favorited tweets.,0.999992847442627,1
The 37 Punniest Tweets Of 2015,1,A collection of 37 humorous tweets from 2015.,0.9999922513961792,1
23 Profoundly Disturbing Photos Of Homemade Sex Machines In America,1,A photo essay on unusual homemade devices in the US.,0.00019775591499637812,0
"A Full Breakdown Of The Long Feud Involving Amber Rose, Kanye West, And The Kardashians",1,"A detailed account of the ongoing dispute between Amber Rose, Kanye West, and the Kardashians.",0.9999918937683105,1
15 Harper Lee-Inspired Tattoos Because We'll Never Forget,1,Harper Lee fans express their admiration through tattoos.,0.99998939037323,1
"We Know Your Favorite ""Harry Potter"" Character Based On Your Go-To Ice Cream Flavor",1,"Guess your favorite ""Harry Potter"" character based on your ice cream preference.",0.9999957084655762,1
"23 Times ""30 Rock"" Perfectly Summed Up Finals Week",1,"Classic ""30 Rock"" Episodes to Get You Through Finals Week",0.9999955892562866,1
16 Pictures That Will Instantly Destroy Any Friendship,1,Photos that spark debate among friends.,8.370207069674507e-06,0
Jennifer Lawrence Hates New Year's Eve For The Same Reason We All Do,1,Jennifer Lawrence Shares A Common Dislike For New Year's Eve,0.9999896287918091,1
"34 Reasons Cersei Is The Most Badass ""Game Of Thrones"" Character",1,"Cersei's boldest moments in ""Game of Thrones"": a retrospective",0.9999867677688599,1
"Lil Bub Is Announcing Her First Album Right Here, Right Now",1,Lil Bub Announces Her First Album,0.0014477043878287077,0
Here's Everything Your Shape Says About You,1,Study reveals how body shape reflects personality traits.,2.832123209373094e-05,0
Which Doritos Flavor Are You,1,Take the Doritos flavor quiz.,0.9999933242797852,1
40 Life Hacks From Disney Movies That Are Borderline Genius,1,Useful Life Lessons Learned from Disney Movies.,2.7799434974440373e-05,0
We Know Which Member Of Your Friend Group You Are Based On Your Zodiac Sign,1,"Your role in your friend group, as told by your zodiac sign.",9.236932237399742e-05,0
How Much Of An Anna Kendrick Fan Are You Actually,1,Test your knowledge of Anna Kendrick trivia.,0.9993240833282471,1
21 Texts Everyone Who Is Anxious Has Definitely Sent,1,Common text patterns among people experiencing anxiety.,0.0015389512991532683,0
17 Tattoos For All Makeup Lovers,1,17 Tattoo Ideas Inspired by Makeup Trends,0.9999955892562866,1
17 Books All Gryffindors Will Love,1,Book recommendations for fans of Gryffindor.,0.999242901802063,1
25 Faces You'll Recognise If You've Ever Had A Period,1,Common experiences of people during their period.,0.7618600130081177,1
26 Gifts For People Who'd Rather Live Between The Pages Of A Book,1,26 Gifts For Avid Readers,0.9999947547912598,1
21 Insane Gadgets To Make Your iPhone Even Cooler,1,21 Unique iPhone Accessories and Their Uses,0.9999951124191284,1
16 Things You See When You Go To Tim Hortons At 6 A.M,1,16 Observations From A Tim Hortons Visit At 6 A.M.,0.9999945163726807,1
"This Couple's ""Half & Half"" Photos Help Them Share Their Lives In Spite Of Distance",1,"Couple uses creative ""half and half"" photography to stay connected despite the distance.",0.9999227523803711,1
Are You More Kim Kardashian Or Paris Hilton,1,Who's the bigger influencer: Kim Kardashian or Paris Hilton?,0.9999903440475464,1
13 Cocktails That'll Knock Santa's Boots Off,1,13 Delicious Cocktails to Serve at Your Holiday Party,0.9999955892562866,1
The New Yorker Released The Perfect Cartoon In Tribute Of Alan Rickman,1,The New Yorker Honors Alan Rickman With A Touching Cartoon.,0.9972749352455139,1
24 Hilariously True Tweets For Retail Workers About The Plastic Bag Charge,1,Retail workers share funny tweets about the plastic bag charge.,0.999951958656311,1
This Quiz Will Determine What Song Is Your Personal Catwalk Jam,1,Find Your Personal Catwalk Jam With This Quiz,0.9999955892562866,1
"21 Times Tumblr Was Funniest About ""Game Of Thrones""",1,"Tumblr users share humorous reactions to ""Game of Thrones""",0.9999938011169434,1
27 Stunning Reasons To Get A Tim Burton Tattoo,1,27 Reasons Why Tim Burton Tattoos Are So Popular,0.9999955892562866,1
We Can Guess Your Age With Just Three Questions About Your WhatsApp Habits,1,Take This Quiz To See If We Can Guess Your Age Based On Your WhatsApp Habits,0.999995231628418,1
This Rainbow-Inspired Hummus Is Almost Too Gorgeous To Eat,1,Colorful hummus platter delights both the eyes and the taste buds.,0.9973709583282471,1
17 Times Sonam Kapoor Was 100% On Point,1,Sonam Kapoor's Most Iconic Looks,0.9999932050704956,1
"Mindy Kaling Really Likes To Troll ""Star Wars"" Fans",1,"Mindy Kaling enjoys playful banter with ""Star Wars"" fans.",0.9999945163726807,1
19 Tweets About Wine That Will Make You Laugh Out Loud,1,19 Amusing Tweets About Wine,0.9999954700469971,1
"Which Occupation From ""The Bachelor"" Should You Actually Be Doing With Your Life",1,"What your favorite ""The Bachelor"" occupation says about you.",0.9999948740005493,1
"20 ""Game Of Thrones"" Questions That Are Impossible To Answer",1,"Challenging ""Game of Thrones"" trivia questions.",0.9998894929885864,1
What's Your Favorite Comedy Movie With A Black Cast,1,Popular Comedy Movies With Black Casts,0.9999868869781494,1
These Are Trap Questions. Do Not Answer Them,1,Avoid answering trap questions.,0.004620077088475227,0
Are You THAT Relative,1,Family gatherings: navigating difficult conversations with relatives.,0.0002630361123010516,0
29 Giant Versions Of Your Favorite Foods You Can Make Yourself,1,Large-Scale Recipes for Popular Foods.,0.00020764220971614122,0
7 Things I Wish I Had Known In My First Year At University,1,7 Reflections on My First Year of University,0.9999949932098389,1
Let's Help You Write Your Letter To Santa,1,Writing a letter to Santa made easy with this helpful guide.,0.12558336555957794,0
27 Faces That Are So Relatable It's Crazy,1,27 Relatable Facial Expressions That Are Sure to Resonate,0.9999954700469971,1
15 Game-Changing Eyeliner Charts If You Suck At Makeup,1,Helpful eyeliner guides for makeup beginners.,0.999845027923584,1
Miss Piggy Opens Up About Split Of The Century And Life After Kermit,1,Miss Piggy discusses her breakup with Kermit and her current life.,0.9999816417694092,1
The Try Guys Try K-Pop Idol Makeup,1,The Try Guys Experiment with K-Pop Idol Makeup,0.9999955892562866,1
"Test Your Memory Of The First Episode Of ""The Office""",1,"Can You Remember The First Episode Of ""The Office""?",0.9999815225601196,1
35 Pictures That Will Bring You Right Back To Elementary School,1,A nostalgic look back at elementary school through 35 photos.,0.11659063398838043,0
You'll Be In Tears After Hearing Josh Groban And Kelly Clarkson Duet,1,Josh Groban and Kelly Clarkson's Emotional Duet,0.9999898672103882,1
Delectable Vegan Dinners,1,Easy and Delicious Vegan Dinner Ideas,0.9999953508377075,1
Test Your Culinary Knowledge,1,Quiz: How Well Do You Know Your Cuisine?,0.9960570335388184,1
18 Newborn Puppies Ready To Take On The World,1,Adorable photos of 18 newborn puppies.,0.9999955892562866,1
26 Times The Indian Internet Blew Up In 2015,1,A look back at 26 trending moments in India's online sphere in 2015.,0.9999954700469971,1
18 Hilarious Memes About Tamales That Are Way Too Real,1,18 Memes About Tamales That Hit Close To Home,0.9999954700469971,1
How Many Of These SpongeBob Faces Do You Recognize,1,Can you name all these SpongeBob faces?,0.9999955892562866,1
30 Times Portland Was Too Portland To Function,1,30 Unique Aspects of Portland's Culture,0.9999947547912598,1
Do You Know Your Husband Well Enough To Recognize His Touch,1,Can you recognize your partner through touch alone?,0.003402300411835313,0
"22 Tweets About ""Lord Of The Rings"" That'll Make You Laugh Every Time",1,"22 Hilarious Tweets About ""Lord Of The Rings""",0.9999953508377075,1
18 Delicious Indian Foods That Aren't Curry,1,18 Indian Dishes to Try Beyond Curry.,0.9999955892562866,1
This Food Stylist Gave Us 5 Tips To Make Normal Food Look Amazing,1,Five tips from a food stylist to enhance the appearance of everyday meals.,0.9999921321868896,1
21 Apps That Will Make Your Christmas Shopping Easy,1,Apps to streamline your Christmas shopping.,1.6208683518925682e-05,0
21 Photos That Prove Scotland Is A Fictional Country,1,21 Photos Highlighting the Beauty of Scotland,0.9999954700469971,1
We Have The Answers To 12 Of Your Most Pressing Star Wars Questions,1,Exploring 12 Intriguing Star Wars Questions and Themes,0.9999955892562866,1
People With A Fear Of Dogs Meet Pit Bull Puppies,1,People With Cynophobia Interact With Pit Bull Puppies.,0.998033344745636,1
9 Christmas Movies If They Were About Cuffing Season,1,Alternative Plotlines for 9 Classic Christmas Movies,0.9999949932098389,1
25 Of The Most Embarrassing Things People Have Done At The Doctor's Office,1,Common Embarrassing Moments People Experience at the Doctor's Office,0.9999953508377075,1
What's The Weirdest Thing Your Dog Does,1,Unique behaviors exhibited by dogs and their potential meanings.,6.464939360739663e-05,0
"This Man Decided To Put ""Jet Fuel Can't Melt Steel Beams"" Conspiracy Theory To The Test",1,Engineer conducts experiment to address 9/11 conspiracy theory.,7.993883627932519e-06,0
"How Well Do You Remember ""A Christmas Story""",1,"Test your memory of ""A Christmas Story""",0.9999946355819702,1
23 Hilarious Memes That Explain Greek Life At A Black School,1,A collection of memes humorously depicts Greek life at an HBCU.,0.9999245405197144,1
Are You Actually A Meme Bob Or A Meme Snob,1,Understanding the nuances of internet humor: are you a meme expert?,0.9997232556343079,1
You Will Want To Marry And Have Babies With This Lumberjack Cake,1,A delicious lumberjack-themed cake recipe you'll want to try.,0.9999935626983643,1
Your Favorite '90s Pop-Punk Anthem Has Been Recreated In This Amazing Video,1,'90s Pop-Punk Anthem Gets a Refresh in New Cover Video,0.9987725615501404,1
